{"schema":"testing-design.generation-receipt.v1","outcome":"complete","attempt":1,"request_digest":"cb410d00e97011ba14e43996037e4fac6ad4b9aee29ae83058697dd8ba48cf6e","input_digest":"cb410d00e97011ba14e43996037e4fac6ad4b9aee29ae83058697dd8ba48cf6e","raw_response_digest":"fd67479baa9b301fbfa709567f076cb2128fd107dee422d35cc782fd04ad8e95","validated_output_digest":"684935a71f8e7f7ac25f8de2681e6910223c158ae9c73b8a172e188da9605930","candidate_set":{"schema":"testing-design.artifact-reference.v1","artifact_schema":"testing-design.candidate-test-case-set.v1","artifact_pointer":".testing/runs/design/generation/candidate-test-case-set.v1.json","artifact_digest":"684935a71f8e7f7ac25f8de2681e6910223c158ae9c73b8a172e188da9605930"},"provider":{"adapter_id":"codex-cli","adapter_version":"1.0.0","model_id":"test-model"},"prompt_template":{"template_id":"testing-design.browser-smoke","template_version":"1.0.0","template_digest":"0000000000000000000000000000000000000000000000000000000000000000"},"policy_id":"testing-design.generation-policy.v1","budget":{"prompt_bytes":1024,"response_bytes":1246,"elapsed_ms":25},"rejected_candidates":{"total":0,"reasons":[]},"timing":{"started_at":"2026-09-04T00:00:00Z","finished_at":"2026-09-04T00:00:00Z","duration_ms":25}}
